{
  "$schema": "./state-transition-matrix.schema.json",
  "schemaVersion": "1.0.0",
  "sourceCatalog": "../../07-data-api-events/specs/state-catalog.json",
  "sourceDesign": "../../05-screens-states-recovery/STATE_MODEL.md",
  "totalStates": 175,
  "states": [
    {
      "axis": "CUSTOMER_ELIGIBILITY",
      "stateCode": "ELIGIBILITY_PENDING",
      "labelKo": "판정 대기",
      "allowedTargets": ["ELIGIBLE", "INELIGIBLE", "ELIGIBILITY_EXPIRED"],
      "representativeForbiddenTargets": ["ELIGIBILITY_SUSPENDED"],
      "forbiddenErrorCode": "STATE_CONFLICT",
      "source": "../../05-screens-states-recovery/STATE_MODEL.md"
    },
    {
      "axis": "CUSTOMER_ELIGIBILITY",
      "stateCode": "ELIGIBLE",
      "labelKo": "판매 허용",
      "allowedTargets": ["ELIGIBILITY_EXPIRED", "ELIGIBILITY_SUSPENDED"],
      "representativeForbiddenTargets": ["ELIGIBILITY_PENDING"],
      "forbiddenErrorCode": "STATE_CONFLICT",
      "source": "../../05-screens-states-recovery/STATE_MODEL.md"
    },
    {
      "axis": "CUSTOMER_ELIGIBILITY",
      "stateCode": "INELIGIBLE",
      "labelKo": "판매 거절",
      "allowedTargets": ["ELIGIBILITY_PENDING"],
      "representativeForbiddenTargets": ["ELIGIBLE"],
      "forbiddenErrorCode": "STATE_CONFLICT",
      "source": "../../05-screens-states-recovery/STATE_MODEL.md"
    },
    {
      "axis": "CUSTOMER_ELIGIBILITY",
      "stateCode": "ELIGIBILITY_EXPIRED",
      "labelKo": "판정 만료",
      "allowedTargets": ["ELIGIBILITY_PENDING"],
      "representativeForbiddenTargets": ["ELIGIBLE"],
      "forbiddenErrorCode": "STATE_CONFLICT",
      "source": "../../05-screens-states-recovery/STATE_MODEL.md"
    },
    {
      "axis": "CUSTOMER_ELIGIBILITY",
      "stateCode": "ELIGIBILITY_SUSPENDED",
      "labelKo": "일시중지",
      "allowedTargets": ["ELIGIBLE", "INELIGIBLE"],
      "representativeForbiddenTargets": ["ELIGIBILITY_PENDING"],
      "forbiddenErrorCode": "STATE_CONFLICT",
      "source": "../../05-screens-states-recovery/STATE_MODEL.md"
    },
    {
      "axis": "INVESTOR_PROTECTION",
      "stateCode": "PROTECTION_REVIEW_PENDING",
      "labelKo": "보호판정 대기",
      "allowedTargets": ["PROTECTION_PASSED", "PROTECTION_FAILED"],
      "representativeForbiddenTargets": ["PROTECTION_EXPIRED"],
      "forbiddenErrorCode": "STATE_CONFLICT",
      "source": "../../05-screens-states-recovery/STATE_MODEL.md"
    },
    {
      "axis": "INVESTOR_PROTECTION",
      "stateCode": "PROTECTION_PASSED",
      "labelKo": "보호판정 통과",
      "allowedTargets": ["PROTECTION_EXPIRED", "DISCLOSURE_CONSENT_PENDING"],
      "representativeForbiddenTargets": ["PROTECTION_REVIEW_PENDING"],
      "forbiddenErrorCode": "STATE_CONFLICT",
      "source": "../../05-screens-states-recovery/STATE_MODEL.md"
    },
    {
      "axis": "INVESTOR_PROTECTION",
      "stateCode": "PROTECTION_FAILED",
      "labelKo": "보호판정 실패",
      "allowedTargets": ["PROTECTION_REVIEW_PENDING"],
      "representativeForbiddenTargets": ["PROTECTION_PASSED"],
      "forbiddenErrorCode": "STATE_CONFLICT",
      "source": "../../05-screens-states-recovery/STATE_MODEL.md"
    },
    {
      "axis": "INVESTOR_PROTECTION",
      "stateCode": "PROTECTION_EXPIRED",
      "labelKo": "보호판정 만료",
      "allowedTargets": ["PROTECTION_REVIEW_PENDING"],
      "representativeForbiddenTargets": ["PROTECTION_PASSED"],
      "forbiddenErrorCode": "STATE_CONFLICT",
      "source": "../../05-screens-states-recovery/STATE_MODEL.md"
    },
    {
      "axis": "INVESTOR_PROTECTION",
      "stateCode": "DISCLOSURE_CONSENT_PENDING",
      "labelKo": "위험공시 동의 대기",
      "allowedTargets": ["DISCLOSURE_CONSENT_VALID", "DISCLOSURE_CONSENT_MISSING"],
      "representativeForbiddenTargets": ["PROTECTION_REVIEW_PENDING"],
      "forbiddenErrorCode": "STATE_CONFLICT",
      "source": "../../05-screens-states-recovery/STATE_MODEL.md"
    },
    {
      "axis": "INVESTOR_PROTECTION",
      "stateCode": "DISCLOSURE_CONSENT_VALID",
      "labelKo": "동의 유효",
      "allowedTargets": ["DISCLOSURE_CONSENT_EXPIRED"],
      "representativeForbiddenTargets": ["PROTECTION_REVIEW_PENDING"],
      "forbiddenErrorCode": "STATE_CONFLICT",
      "source": "../../05-screens-states-recovery/STATE_MODEL.md"
    },
    {
      "axis": "INVESTOR_PROTECTION",
      "stateCode": "DISCLOSURE_CONSENT_MISSING",
      "labelKo": "동의 누락",
      "allowedTargets": ["DISCLOSURE_CONSENT_VALID"],
      "representativeForbiddenTargets": ["PROTECTION_REVIEW_PENDING"],
      "forbiddenErrorCode": "STATE_CONFLICT",
      "source": "../../05-screens-states-recovery/STATE_MODEL.md"
    },
    {
      "axis": "INVESTOR_PROTECTION",
      "stateCode": "DISCLOSURE_CONSENT_EXPIRED",
      "labelKo": "동의 만료",
      "allowedTargets": ["DISCLOSURE_CONSENT_PENDING"],
      "representativeForbiddenTargets": ["PROTECTION_REVIEW_PENDING"],
      "forbiddenErrorCode": "STATE_CONFLICT",
      "source": "../../05-screens-states-recovery/STATE_MODEL.md"
    },
    {
      "axis": "COMPLAINT",
      "stateCode": "COMPLAINT_SUBMITTED",
      "labelKo": "접수",
      "allowedTargets": ["COMPLAINT_ASSIGNED"],
      "representativeForbiddenTargets": ["COMPLAINT_IN_PROGRESS"],
      "forbiddenErrorCode": "STATE_CONFLICT",
      "source": "../../05-screens-states-recovery/STATE_MODEL.md"
    },
    {
      "axis": "COMPLAINT",
      "stateCode": "COMPLAINT_ASSIGNED",
      "labelKo": "책임기관 배정",
      "allowedTargets": ["COMPLAINT_IN_PROGRESS"],
      "representativeForbiddenTargets": ["COMPLAINT_SUBMITTED"],
      "forbiddenErrorCode": "STATE_CONFLICT",
      "source": "../../05-screens-states-recovery/STATE_MODEL.md"
    },
    {
      "axis": "COMPLAINT",
      "stateCode": "COMPLAINT_IN_PROGRESS",
      "labelKo": "처리 중",
      "allowedTargets": ["COMPLAINT_RESPONSE_RECORDED"],
      "representativeForbiddenTargets": ["COMPLAINT_SUBMITTED"],
      "forbiddenErrorCode": "STATE_CONFLICT",
      "source": "../../05-screens-states-recovery/STATE_MODEL.md"
    },
    {
      "axis": "COMPLAINT",
      "stateCode": "COMPLAINT_RESPONSE_RECORDED",
      "labelKo": "답변 기록",
      "allowedTargets": ["COMPLAINT_CORRECTION_REVIEW", "COMPLAINT_CLOSED"],
      "representativeForbiddenTargets": ["COMPLAINT_SUBMITTED"],
      "forbiddenErrorCode": "STATE_CONFLICT",
      "source": "../../05-screens-states-recovery/STATE_MODEL.md"
    },
    {
      "axis": "COMPLAINT",
      "stateCode": "COMPLAINT_CORRECTION_REVIEW",
      "labelKo": "정정 검토",
      "allowedTargets": ["COMPLAINT_IN_PROGRESS", "COMPLAINT_CLOSED"],
      "representativeForbiddenTargets": ["COMPLAINT_SUBMITTED"],
      "forbiddenErrorCode": "STATE_CONFLICT",
      "source": "../../05-screens-states-recovery/STATE_MODEL.md"
    },
    {
      "axis": "COMPLAINT",
      "stateCode": "COMPLAINT_CLOSED",
      "labelKo": "종결",
      "allowedTargets": [],
      "representativeForbiddenTargets": ["COMPLAINT_SUBMITTED"],
      "forbiddenErrorCode": "STATE_CONFLICT",
      "source": "../../05-screens-states-recovery/STATE_MODEL.md"
    },
    {
      "axis": "WALLET_LINKAGE",
      "stateCode": "WALLET_UNLINKED",
      "labelKo": "지갑 미연결",
      "allowedTargets": ["WALLET_LINK_APPROVAL_PENDING"],
      "representativeForbiddenTargets": ["WALLET_LINKED"],
      "forbiddenErrorCode": "STATE_CONFLICT",
      "source": "../../05-screens-states-recovery/STATE_MODEL.md"
    },
    {
      "axis": "WALLET_LINKAGE",
      "stateCode": "WALLET_LINK_APPROVAL_PENDING",
      "labelKo": "연결 승인 대기",
      "allowedTargets": ["WALLET_LINKED", "WALLET_UNLINKED"],
      "representativeForbiddenTargets": ["WALLET_REPLACEMENT_REVIEW"],
      "forbiddenErrorCode": "STATE_CONFLICT",
      "source": "../../05-screens-states-recovery/STATE_MODEL.md"
    },
    {
      "axis": "WALLET_LINKAGE",
      "stateCode": "WALLET_LINKED",
      "labelKo": "연결 완료",
      "allowedTargets": ["WALLET_REPLACEMENT_REVIEW", "WALLET_FROZEN"],
      "representativeForbiddenTargets": ["WALLET_UNLINKED"],
      "forbiddenErrorCode": "STATE_CONFLICT",
      "source": "../../05-screens-states-recovery/STATE_MODEL.md"
    },
    {
      "axis": "WALLET_LINKAGE",
      "stateCode": "WALLET_REPLACEMENT_REVIEW",
      "labelKo": "교체 검토",
      "allowedTargets": ["WALLET_LINKED", "WALLET_FROZEN"],
      "representativeForbiddenTargets": ["WALLET_UNLINKED"],
      "forbiddenErrorCode": "STATE_CONFLICT",
      "source": "../../05-screens-states-recovery/STATE_MODEL.md"
    },
    {
      "axis": "WALLET_LINKAGE",
      "stateCode": "WALLET_FROZEN",
      "labelKo": "지갑 동결",
      "allowedTargets": ["WALLET_REPLACEMENT_REVIEW", "WALLET_LINKED"],
      "representativeForbiddenTargets": ["WALLET_UNLINKED"],
      "forbiddenErrorCode": "STATE_CONFLICT",
      "source": "../../05-screens-states-recovery/STATE_MODEL.md"
    },
    {
      "axis": "PRODUCT_COMMON",
      "stateCode": "PRODUCT_CANDIDATE",
      "labelKo": "후보",
      "allowedTargets": ["PRODUCT_REVIEWED", "PRODUCT_INFORMATION_UNCONFIRMED"],
      "representativeForbiddenTargets": ["MATERIAL_EVENT_REVIEW"],
      "forbiddenErrorCode": "STATE_CONFLICT",
      "source": "../../05-screens-states-recovery/STATE_MODEL.md"
    },
    {
      "axis": "PRODUCT_COMMON",
      "stateCode": "PRODUCT_REVIEWED",
      "labelKo": "검토 완료",
      "allowedTargets": ["PRODUCT_INFORMATION_UNCONFIRMED", "MATERIAL_EVENT_REVIEW"],
      "representativeForbiddenTargets": ["PRODUCT_CANDIDATE"],
      "forbiddenErrorCode": "STATE_CONFLICT",
      "source": "../../05-screens-states-recovery/STATE_MODEL.md"
    },
    {
      "axis": "PRODUCT_COMMON",
      "stateCode": "PRODUCT_INFORMATION_UNCONFIRMED",
      "labelKo": "정보 미확인",
      "allowedTargets": ["PRODUCT_CANDIDATE", "PRODUCT_REVIEWED"],
      "representativeForbiddenTargets": ["MATERIAL_EVENT_REVIEW"],
      "forbiddenErrorCode": "STATE_CONFLICT",
      "source": "../../05-screens-states-recovery/STATE_MODEL.md"
    },
    {
      "axis": "PRODUCT_COMMON",
      "stateCode": "MATERIAL_EVENT_REVIEW",
      "labelKo": "중요사건 검토",